{
  "meta": {
    "timestamp": "2026-02-11T12:11:35.750Z",
    "commit_sha": "4570c57a210cf55c7893432159be17acd379ccd3",
    "plan_hash": "3abf2733f9f3a0e7349614df275955bf5c7e9c6a14ea66e5d958aec51a7a809b",
    "toolchain": {
      "node": "v22.19.0",
      "npm": "11.8.0",
      "rust": "rustc 1.89.0 (29483883e 2025-08-04)"
    }
  },
  "results": [],
  "lint_status": {
    "passed": true,
    "errors": 0,
    "warnings": 0
  },
  "determinism_vectors": {
    "pack_hash": "1af4fe7d39f48422ef5e95c9ab2e2d051bcd701324f4590b745fc701567e2d2a"
  }
}